{
  "pr": {
    "headline": "매일 손이 가는 제품 — 자연스러운 데일리 제품",
    "subhead": "본인 사용 + 가족 선물(가설) 가설 페르소나, VOC 빈도 기반",
    "problem": "소비자는 효능보다 '' 같은 사용 경험으로 제품을 평가한다(voc.json 근거).",
    "solution": {
      "differentiators": [
        "데일리 제품감",
        "신뢰할 수 있는 구성"
      ],
      "today_alternatives": [
        "기존 대안 제품",
        "직접 비교 대상"
      ]
    },
    "quotes": []
  },
  "faq": {
    "external": [
      {
        "q": "구성은?",
        "a": "제품 구성·함량은 제품 표기·첨부문서를 확인하세요."
      }
    ],
    "internal": [
      {
        "q": "규제/실증 리스크?",
        "a": "기능성 상태=unknown 항목은 주장 불가. 속효('단 1일') 표현 금지. 절대표현(최초/1위/무결점) 금지."
      },
      {
        "q": "근거 없는 효능 주장?",
        "a": "claim-basis 근거 없는 효능(없음)은 unsupported로 카피 배제."
      },
      {
        "q": "VOC 0건 개념?",
        "a": "없음 는 리뷰 0건 → 컨셉 주축 금지."
      }
    ]
  },
  "sensitive_labels": [],
  "output_type": {
    "regulatory_domain": "drug",
    "deliverable_format": "multipage_bm"
  }
}
